g:id,g:gtin,g:title,g:description,g:link,g:image_link,g:brand,g:condition,g:availability,g:price,g:sale_price,g:product_type
SM-G998BZKDEUB,8806090887505,Galaxy S21 Ultra 5G,"Presentamos el nuevo Galaxy S21 Ultra 5G. Diseñado con una exclusiva cámara que revolucionará el mundo de la fotografía. Ahora podrás grabar en 8K y sacar fotos inéditas a la vez. Además, el nuevo Galaxy incorpora un chip más rápido y potente, un cristal más fuerte, 5G y batería para todo el día.",https://www.samsung.com/es/smartphones/galaxy-s21-5g/buy/?modelCode=SM-G998BZKDEUB&cid=es_pd_ppc_google_galaxy-s21-ultra-5g-sm-g998bzkdeub_ongoing_im-smartphone-automatic-feed_pla_none_none,https://images.samsung.com/is/image/samsung/p6pim/es/galaxy-s21/gallery/es-galaxy-s21-ultra-5g-g988-sm-g998bzkdeub-368961175?$320_320_PNG$,Samsung,new,in stock,1259.00 EUR,969.00 EUR,Productos | Smartphones | Galaxy S21 Series | Smartphones | Galaxy S21 Series | Productos | Mobile | Smartphones | Galaxy S21 Series
EP-TA800NWEGEU,8806090973338,Wall Charger for Super Fast Charging (25W),Da a tus dispositivos la carga que se merecen. El Wall Charger for Super Fast Charging (25W) ofrece una carga superrápida de hasta 25W para dispositivos compatibles. Utiliza el Wall Charger con un cable de carga oficial de Samsung Tipo-C a Tipo-C para unos resultados óptimos.,https://shop.samsung.com/es/Productos/Accesorios/Accesorios-smartphones/Wall-Charger-for-Super-Fast-Charging-%2825W%29/p/EP-TA800NWEGEU?cid=es_pd_ppc_google_wall-charger-for-super-fast-charging-25w-ep-ta800nwegeu_ongoing_im-accessories-automatic-feed_pla_none_none,https://images.samsung.com/is/image/samsung/p6pim/es/ep-ta800nwegeu/gallery/es-wall-charger-for-super-fast-charging-25w-302777-ep-ta800nwegeu-366547079?$320_320_PNG$,Samsung,new,out of stock,24.90 EUR,24.90 EUR,Productos | Accesorios | Accesorios smartphones | Accesorios | Accesorios smartphones
EP-P4300TBEGEU,8806090962905,Wireless Charger Duo,"Tu teléfono se carga incluso estando protegido. La carga alcanzará tu teléfono a través de cualquier funda ligera, así que no hace falta que lo saques: ponlo en su sitio y a cargar.",https://www.samsung.com/es/mobile-accessories/wireless-charger-duo-black-ep-p4300tbegeu/?cid=es_pd_ppc_google_wireless-charger-duo-ep-p4300tbegeu_ongoing_im-accessories-automatic-feed_pla_none_none,https://images.samsung.com/is/image/samsung/p6pim/es/galaxy-s21/gallery/es-wireless-charger-duo-ep-p4300tbegeu-363227006?$320_320_PNG$,Samsung,new,preorder,59.90 EUR,59.90 EUR,Productos | Accesorios | Accesorios smartphones | Cargadores y Baterias | Accesorios | Accesorios smartphones | Cargadores y Baterias
SM-G998BZSGEUB,8806090886973,Galaxy S21 Ultra 5G,"Presentamos el nuevo Galaxy S21 Ultra 5G. Diseñado con una exclusiva cámara que revolucionará el mundo de la fotografía. Ahora podrás grabar en 8K y sacar fotos inéditas a la vez. Además, el nuevo Galaxy incorpora un chip más rápido y potente, un cristal más fuerte, 5G y batería para todo el día.",https://www.samsung.com/es/smartphones/galaxy-s21-5g/buy/?modelCode=SM-G998BZSGEUB&cid=es_pd_ppc_google_galaxy-s21-ultra-5g-sm-g998bzsgeub_ongoing_im-smartphone-automatic-feed_pla_none_none,https://images.samsung.com/is/image/samsung/p6pim/es/galaxy-s21/gallery/es-galaxy-s21-ultra-5g-g988-sm-g998bzsgeub-368961308?$320_320_PNG$,Samsung,new,in stock,1309.00 EUR,999.00 EUR,Productos | Smartphones | Galaxy S21 Series | Smartphones | Galaxy S21 Series | Productos | Mobile | Smartphones | Galaxy S21 Series
MZ-77E1T0B/EU,8806090545917,SSD 870 EVO SATA III 1TB,"Presentamos el último modelo de la serie SSD más vendida del mundo. El 870 EVO se basa en la tecnología SSD pionera de Samsung, con un rendimiento mejorado y una mayor fiabilidad y compatibilidad para cubrir las necesidades de todos los perfiles, desde creadores de contenido o profesionales de la informática hasta usuarios del día a día.",https://shop.samsung.com/es/INFORM%C3%81TICA/Memory/SSD-870-EVO-SATA-III/p/MZ-77E1T0B/EU?cid=es_pd_ppc_google_ssd-870-evo-sata-iii-1tb-mz-77e1t0b-eu_ongoing_it-memory-automatic-feed_pla_none_none,https://images.samsung.com/is/image/samsung/p6pim/es/mz-77e1t0b-eu/gallery/es-870-evo-sata-3-2-5-ssd-mz-77e1t0b-eu-372776334?$320_320_PNG$,Samsung,new,out of stock,157.99 EUR,157.99 EUR,Productos | Informatica | Almacenamiento | Discos Solidos SSD | Informatica | Almacenamiento | Discos Solidos SSD
MZ-77E250B/EU,8806090545931,SSD 870 EVO SATA III 250GB,"Presentamos el último modelo de la serie SSD más vendida del mundo. El 870 EVO se basa en la tecnología SSD pionera de Samsung, con un rendimiento mejorado y una mayor fiabilidad y compatibilidad para cubrir las necesidades de todos los perfiles, desde creadores de contenido o profesionales de la informática hasta usuarios del día a día.",https://shop.samsung.com/es/INFORM%C3%81TICA/Memory/SSD-870-EVO-SATA-III/p/MZ-77E250B/EU?cid=es_pd_ppc_google_ssd-870-evo-sata-iii-250gb-mz-77e250b-eu_ongoing_it-memory-automatic-feed_pla_none_none,https://images.samsung.com/is/image/samsung/p6pim/es/mz-77e250b-eu/gallery/es-870-evo-sata-3-2-5-ssd-mz-77e250b-eu-372776362?$320_320_PNG$,Samsung,new,in stock,54.99 EUR,54.99 EUR,Productos | Informatica | Almacenamiento | Discos Solidos SSD | Informatica | Almacenamiento | Discos Solidos SSD
MZ-77E2T0B/EU,8806090545900,SSD 870 EVO SATA III 2TB,"Presentamos el último modelo de la serie SSD más vendida del mundo. El 870 EVO se basa en la tecnología SSD pionera de Samsung, con un rendimiento mejorado y una mayor fiabilidad y compatibilidad para cubrir las necesidades de todos los perfiles, desde creadores de contenido o profesionales de la informática hasta usuarios del día a día.",https://shop.samsung.com/es/INFORM%C3%81TICA/Memory/SSD-870-EVO-SATA-III/p/MZ-77E2T0B/EU?cid=es_pd_ppc_google_ssd-870-evo-sata-iii-2tb-mz-77e2t0b-eu_ongoing_it-memory-automatic-feed_pla_none_none,https://images.samsung.com/is/image/samsung/p6pim/es/mz-77e2t0b-eu/gallery/es-870-evo-sata-3-2-5-ssd-mz-77e2t0b-eu-372776390?$320_320_PNG$,Samsung,new,in stock,303.99 EUR,303.99 EUR,Productos | Informatica | Almacenamiento | Discos Solidos SSD | Informatica | Almacenamiento | Discos Solidos SSD
MZ-77E4T0B/EU,8806090545894,SSD 870 EVO SATA III 4TB,"Presentamos el último modelo de la serie SSD más vendida del mundo. El 870 EVO se basa en la tecnología SSD pionera de Samsung, con un rendimiento mejorado y una mayor fiabilidad y compatibilidad para cubrir las necesidades de todos los perfiles, desde creadores de contenido o profesionales de la informática hasta usuarios del día a día.",https://shop.samsung.com/es/INFORM%C3%81TICA/Memory/SSD-870-EVO-SATA-III/p/MZ-77E4T0B/EU?cid=es_pd_ppc_google_ssd-870-evo-sata-iii-4tb-mz-77e4t0b-eu_ongoing_it-memory-automatic-feed_pla_none_none,https://images.samsung.com/is/image/samsung/p6pim/es/mz-77e4t0b-eu/gallery/es-870-evo-sata-3-2-5-ssd-mz-77e4t0b-eu-372776418?$320_320_PNG$,Samsung,new,in stock,615.99 EUR,615.99 EUR,Productos | Informatica | Almacenamiento | Discos Solidos SSD | Informatica | Almacenamiento | Discos Solidos SSD
MZ-77E500B/EU,8806090545924,SSD 870 EVO SATA III 500GB,"Presentamos el último modelo de la serie SSD más vendida del mundo. El 870 EVO se basa en la tecnología SSD pionera de Samsung, con un rendimiento mejorado y una mayor fiabilidad y compatibilidad para cubrir las necesidades de todos los perfiles, desde creadores de contenido o profesionales de la informática hasta usuarios del día a día.",https://shop.samsung.com/es/INFORM%C3%81TICA/Memory/SSD-870-EVO-SATA-III/p/MZ-77E500B/EU?cid=es_pd_ppc_google_ssd-870-evo-sata-iii-500gb-mz-77e500b-eu_ongoing_it-memory-automatic-feed_pla_none_none,https://images.samsung.com/is/image/samsung/p6pim/es/mz-77e500b-eu/gallery/es-870-evo-sata-3-2-5-ssd-mz-77e500b-eu-372776445?$320_320_PNG$,Samsung,new,in stock,90.99 EUR,90.99 EUR,Productos | Informatica | Almacenamiento | Discos Solidos SSD | Informatica | Almacenamiento | Discos Solidos SSD
SM-A326BZKVEUB,8806090963865,Galaxy A32 5G,"Con la próxima generación de datos móviles, la velocidad del 5G cambia tu experiencia y la forma en que compartes los contenidos. Desde una experiencia de juego y de streaming más fluida, a compartir y bajar contenidos de forma súper rápida. Actualízate a Galaxy A32 5G y acelera tu experiencia con un smartphone.",https://www.samsung.com/es/smartphones/galaxy-a/galaxy-a32-5g-black-128gb-sm-a326bzkveub/buy/?cid=es_pd_ppc_google_galaxy-a32-5g-sm-a326bzkveub_ongoing_im-smartphone-automatic-feed_pla_none_none,https://images.samsung.com/is/image/samsung/p6pim/es/sm-a326bzkveub/gallery/es-galaxy-a32-5g-a326-sm-a326bzkveub-382477685?$320_320_PNG$,Samsung,new,in stock,299.00 EUR,259.00 EUR,Productos | Smartphones | Galaxy A Series | Smartphones | Galaxy A Series | Productos | Mobile | Smartphones | Galaxy A Series
WW80TA046AE/EC,8806090605406,Lavadora Estándar Clasificación Energética B Serie 50 8kg Blanco WW80TA046AE,,https://www.samsung.com/es/washers-and-dryers/washing-machines/ww5000t-front-loading-eco-bubble-hygiene-steam-dit-8kg-white-ww80ta046ae-ec/?cid=es_pd_ppc_google_lavadora-estandar-clasificacion-energetica-b-serie-50-8kg-blanco-ww80ta046ae-ww80ta046ae-ec_ongoing_da-washing-automatic-feed_pla_none_none,https://images.samsung.com/is/image/samsung/p6pim/es/ww80ta046ae-ec/gallery/es-front-loading-washer-ww80ta046aeef-364503-ww80ta046ae-ec-352153708?$320_320_PNG$,Samsung,new,in stock,499.00 EUR,439.00 EUR,Productos | Electrodomesticos | Electrodomesticos
WW80T534DTW/S3,8806090603297,Lavadora Estándar Clasificación Energética B Serie 53 8kg Blanco WW80T534DTW,"Disfruta del lavado más eficiente, incluso a baja temperatura*, con la tecnología EcoBubble™. El detergente se convierte en burbujas, que penetran en los tejidos más rápido y eliminan más fácilmente la suciedad, mientras ahorran energía y protegen su color y textura**.",https://www.samsung.com/es/washers-and-dryers/washing-machines/ww5300t-front-loading-eco-bubble-ai-control-auto-dispense-8kg-white-ww80t534dtw-s3/?cid=es_pd_ppc_google_lavadora-estandar-clasificacion-energetica-b-serie-53-8kg-blanco-ww80t534dtw-ww80t534dtw-s3_ongoing_da-washing-automatic-feed_pla_none_none,https://images.samsung.com/is/image/samsung/p6pim/es/ww80t534dtw-s3/gallery/es-front-loading-washer-ww10t534daws1-ww80t534dtw-s3-343763215?$320_320_PNG$,Samsung,new,in stock,569.00 EUR,569.00 EUR,Productos | Electrodomesticos | Electrodomesticos
SM-A025GZKEEUB,8806090872952,Galaxy A02s,"Expande tu mundo con la pantalla Infinity-V de 6,5” pulgadas de Galaxy A02s. Gracias a la tecnología HD+, todos tus contenidos se verán mucho más nítidos y claros.",https://shop.samsung.com/es/Productos/Smartphones/Galaxy-A-Series/Galaxy-A02s/p/SM-A025GZKEEUBbuy/?cid=es_pd_ppc_google_galaxy-a02s-sm-a025gzkeeub_ongoing_im-smartphone-automatic-feed_pla_none_none,https://images.samsung.com/is/image/samsung/p6pim/es/sm-a025gzkeeub/gallery/es-galaxy-a02s-a025-sm-a025gzkeeub-384196831?$320_320_PNG$,Samsung,new,in stock,150.00 EUR,150.00 EUR,Productos | Smartphones | Galaxy A Series | Smartphones | Galaxy A Series | Productos | Mobile | Smartphones | Galaxy A Series
SM-A025GZWEEUB,8806090873300,Galaxy A02s,"Expande tu mundo con la pantalla Infinity-V de 6,5” pulgadas de Galaxy A02s. Gracias a la tecnología HD+, todos tus contenidos se verán mucho más nítidos y claros.",https://shop.samsung.com/es/Productos/Smartphones/Galaxy-A-Series/Galaxy-A02s/p/SM-A025GZWEEUBbuy/?cid=es_pd_ppc_google_galaxy-a02s-sm-a025gzweeub_ongoing_im-smartphone-automatic-feed_pla_none_none,https://images.samsung.com/is/image/samsung/p6pim/es/sm-a025gzweeub/gallery/es-galaxy-a02s-a025-sm-a025gzweeub-384196848?$320_320_PNG$,Samsung,new,in stock,150.00 EUR,150.00 EUR,Productos | Smartphones | Galaxy A Series | Smartphones | Galaxy A Series | Productos | Mobile | Smartphones | Galaxy A Series
RS68A8842S9/EF,8806090805677,Frigorífico Side by Side Metal Cooling Inox Clasificación Energética D RS68A8842S9/EF, ,https://www.samsung.com/es/refrigerators/side-by-side/rs8000nc--8-609l-silver-rs68a8842s9-ef/?cid=es_pd_ppc_google_frigorifico-side-by-side-metal-cooling-inox-clasificacion-energetica-d-rs68a8842s9-ef-rs68a8842s9-ef_ongoing_da-refrigerator-automatic-feed_pla_none_none,https://images.samsung.com/is/image/samsung/p6pim/es/rs68a8842s9-ef/gallery/es-rs8000nc-8-373723-rs68a8842s9-ef-379649903?$320_320_PNG$,Samsung,new,in stock,1779.00 EUR,1535.13 EUR,Productos | Electrodomesticos | Frigorificos | Side by Side | Electrodomesticos | Frigorificos | Side by Side
RS66A8101S9/EF,8806090798313,Frigorífico Side by Side Sin Dispensador Inox Clasificación Energética E RS66A8101S9/EF, ,https://www.samsung.com/es/refrigerators/side-by-side/rs8000nc-6-647l-silver-rs66a8101s9-ef/?cid=es_pd_ppc_google_frigorifico-side-by-side-sin-dispensador-inox-clasificacion-energetica-e-rs66a8101s9-ef-rs66a8101s9-ef_ongoing_da-refrigerator-automatic-feed_pla_none_none,https://images.samsung.com/is/image/samsung/p6pim/es/rs66a8101s9-ef/gallery/es-rs8000nc-6-rs66a8101s9-ef-379080803?$320_320_PNG$,Samsung,new,preorder,1469.00 EUR,1267.63 EUR,Productos | Electrodomesticos | Frigorificos | Side by Side | Electrodomesticos | Frigorificos | Side by Side
RS68A8831WW/EF,8806090805585,Frigorífico Side by Side Twin Cooling Blanco Clasificación Energética E RS68A8831WW/EF,"Función a través de la cual la temperatura de tu frigorífico se mantiene estable, consiguiendo reducir la oscilación de grados entre los estantes, independientemente de la temperatura exterior. Conserva la frescura, el sabor y la textura de los alimentos durante más tiempo. El frigorífico enfriará cada rincón de manera uniforme.",https://www.samsung.com/es/refrigerators/side-by-side/rs8000nc--8-609l-white-rs68a8831ww-ef/?cid=es_pd_ppc_google_frigorifico-side-by-side-twin-cooling-blanco-clasificacion-energetica-e-rs68a8831ww-ef-rs68a8831ww-ef_ongoing_da-refrigerator-automatic-feed_pla_none_none,https://images.samsung.com/is/image/samsung/p6pim/es/rs68a8831ww-ef/gallery/es-rs8000nc-8-373141-rs68a8831ww-ef-376273777?$320_320_PNG$,Samsung,new,in stock,1679.00 EUR,1448.84 EUR,Productos | Electrodomesticos | Frigorificos | Side by Side | Electrodomesticos | Frigorificos | Side by Side
RS68A8842B1/EF,8806090798405,Frigorífico Side by Side Metal Cooling Clasificación Energética D RS68A8842B1/EF, ,https://www.samsung.com/es/refrigerators/side-by-side/rs8000nc--8-609l-black-rs68a8842b1-ef/?cid=es_pd_ppc_google_frigorifico-side-by-side-metal-cooling-clasificacion-energetica-d-rs68a8842b1-ef-rs68a8842b1-ef_ongoing_da-refrigerator-automatic-feed_pla_none_none,https://images.samsung.com/is/image/samsung/p6pim/es/rs68a8842b1-ef/gallery/es-rs8000nc-8-rs68a8842b1-ef-375146441?$320_320_PNG$,Samsung,new,in stock,1879.00 EUR,1621.42 EUR,Productos | Electrodomesticos | Frigorificos | Side by Side | Electrodomesticos | Frigorificos | Side by Side
SM-A525FZKGEUB,8806090987557,Galaxy A52,"Con dos altavoces - uno encima y otro abajo -, puedes disfrutar de una experiencia de audio estéreo sin auriculares. Lleva tus noches de cine o tus juegos favoritos a otro nivel con un sonido cinematográfico que te atrapará en cada escena.",https://www.samsung.com/es/smartphones/galaxy-a/galaxy-a52-5g/buy/?modelCode=SM-A525FZKGEUB&cid=es_pd_ppc_google_galaxy-a52-sm-a525fzkgeub_ongoing_im-smartphone-automatic-feed_pla_none_none,https://images.samsung.com/is/image/samsung/p6pim/es/galaxy-a52/gallery/es-galaxy-a52-a525-sm-a525fzkgeub-400297135?$320_320_PNG$,Samsung,new,in stock,349.00 EUR,319.00 EUR,Productos | Smartphones | Galaxy A Series | Smartphones | Galaxy A Series | Productos | Mobile | Smartphones | Galaxy A Series
SM-A325FZBGEUB,8806092081925,Galaxy A32,    ,https://www.samsung.com/es/smartphones/galaxy-a/galaxy-a32-awesome-blue-128gb-sm-a325fzbgeub/buy/?cid=es_pd_ppc_google_galaxy-a32-sm-a325fzbgeub_ongoing_im-smartphone-automatic-feed_pla_none_none,https://images.samsung.com/is/image/samsung/p6pim/es/sm-a325fzbgeub/gallery/es-galaxy-a32-a325-sm-a325fzbgeub-399187679?$320_320_PNG$,Samsung,new,in stock,279.00 EUR,239.00 EUR,Productos | Smartphones | Galaxy A Series | Smartphones | Galaxy A Series | Productos | Mobile | Smartphones | Galaxy A Series
SM-A325FZKGEUB,8806092082649,Galaxy A32,    ,https://www.samsung.com/es/smartphones/galaxy-a/galaxy-a32-awesome-black-128gb-sm-a325fzkgeub/buy/?cid=es_pd_ppc_google_galaxy-a32-sm-a325fzkgeub_ongoing_im-smartphone-automatic-feed_pla_none_none,https://images.samsung.com/is/image/samsung/p6pim/es/sm-a325fzkgeub/gallery/es-galaxy-a32-a325-sm-a325fzkgeub-399187702?$320_320_PNG$,Samsung,new,in stock,279.00 EUR,239.00 EUR,Productos | Smartphones | Galaxy A Series | Smartphones | Galaxy A Series | Productos | Mobile | Smartphones | Galaxy A Series
SM-R180NZKAEUB,8806090486166,Galaxy Buds Live,Sonido hecho para tus oídos,https://www.samsung.com/es/audio-sound/galaxy-buds/galaxy-buds-live-mystic-black-sm-r180nzkae/?cid=es_pd_ppc_google_galaxy-buds-live-sm-r180nzkaeub_ongoing_im-wearables-automatic-feed_pla_none_none,https://images.samsung.com/is/image/samsung/es/galaxy-note20/gallery/es-galaxy-buds-live-r180-sm-r180nzkaeub-frontmysticblack-275602680?$320_320_PNG$,Samsung,new,in stock,179.90 EUR,179.90 EUR,Productos | Wearables | Galaxy Buds | Wearables | Galaxy Buds | Productos | Mobile | Wearables | Galaxy Buds
RS68A8522S9/EF,8806090805349,Frigorífico Side by Side Twin Cooling Inox RS68A8522S9/EF, eamp;lt;span eamp;gt;,https://www.samsung.com/es/refrigerators/side-by-side/rs8000nc--8-609l-silver-rs68a8522s9-ef/?cid=es_pd_ppc_google_frigorifico-side-by-side-twin-cooling-inox-rs68a8522s9-ef-rs68a8522s9-ef_ongoing_da-refrigerator-automatic-feed_pla_none_none,https://images.samsung.com/is/image/samsung/p6pim/es/rs68a8522s9-ef/gallery/es-rs8000nc-8-378004-rs68a8522s9-ef-397373786?$320_320_PNG$,Samsung,new,in stock,1779.00 EUR,1535.13 EUR,Productos | Electrodomesticos | Frigorificos | Electrodomesticos | Frigorificos
HW-A450/ZF,8806092081703,Barra de sonido HW-A450 con Modo Juego y Subwoofer (2021),,https://www.samsung.com/es/audio-devices/soundbar/a450-black-hw-a450-zf/?cid=es_pd_ppc_google_barra-de-sonido-hw-a450-con-modo-juego-y-subwoofer-2021-hw-a450-zf_ongoing_vd-audio-automatic-feed_pla_none_none,https://images.samsung.com/is/image/samsung/p6pim/es/hw-a450-zf/gallery/es-hw-a450-hw-a450-zf-530677824?$320_320_PNG$,Samsung,new,in stock,249.00 EUR,219.00 EUR,Productos | TV/Audio | Audio/Video | Barras y Accesorios de Sonido | TV/Audio | Audio/Video | Barras y Accesorios de Sonido
HW-Q800A/ZF,8806092077713,Barra de sonido HW-Q800A Space Fit Sound Dolby Atmos DTS:X (2021),,https://www.samsung.com/es/audio-devices/soundbar/q800a-black-hw-q800a-zf/?cid=es_pd_ppc_google_barra-de-sonido-hw-q800a-space-fit-sound-dolby-atmos-dts:x-2021-hw-q800a-zf_ongoing_vd-audio-automatic-feed_pla_none_none,https://images.samsung.com/is/image/samsung/p6pim/es/hw-q800a-zf/gallery/es-hw-q800a-hw-q800a-zf-530671492?$320_320_PNG$,Samsung,new,preorder,699.00 EUR,659.00 EUR,
HW-Q600A/ZF,8806092078338,Barra de sonido HW-Q600A Modo Juego Pro Dolby Atmos DTS:X (2021),,https://www.samsung.com/es/audio-devices/soundbar/q600a-black-hw-q600a-zf/?cid=es_pd_ppc_google_barra-de-sonido-hw-q600a-modo-juego-pro-dolby-atmos-dts:x-2021-hw-q600a-zf_ongoing_vd-audio-automatic-feed_pla_none_none,https://images.samsung.com/is/image/samsung/p6pim/es/hw-q600a-zf/gallery/es-hw-q600a-hw-q600a-zf-530663513?$320_320_PNG$,Samsung,new,in stock,499.00 EUR,439.00 EUR,
RB38T600ESA/EF,8806090561832,Frigorífico Combi 390L Inox 2M Clasificación Energética E RB38T600ESA,Más espacio interior manteniendo el mismo tamaño exterior. Samsung ha reducido el grosor de las paredes maximizando la capacidad interior alcanzando hasta 390 litros de capacidad bruta*.,https://www.samsung.com/es/refrigerators/bottom-mount-freezer/rb7300t-spacemax-390l-silver-rb38t600esa-ef/?cid=es_pd_ppc_google_frigorifico-combi-390l-inox-2m-clasificacion-energetica-e-rb38t600esa-rb38t600esa-ef_ongoing_da-refrigerator-automatic-feed_pla_none_none,https://images.samsung.com/is/image/samsung/p6pim/es/rb38t600esa-ef/gallery/es-rb7300t-rb38t600esa-ef-431733294?$320_320_PNG$,Samsung,new,in stock,729.00 EUR,729.00 EUR,Productos | Electrodomesticos | Electrodomesticos
GP-XVR500BRCJW,7613119114235,Correa Braloba Active Leather (20mm) Galaxy Watch Active  eamp; Galaxy Watch3,"La colección Active Leather para Galaxy Watch3 41mm, Galaxy Watch Active2, Galaxy Watch Active, Galaxy Watch 42mm y modelos Gear Sport está fabricada con genuino cuero italiano, combinado con un diseño simple y brillante. Está disponible en una versión más clásica y otra más colorida. Elige el modelo que más se adapte a ti y a tu estilo de vida.",https://www.samsung.com/es/mobile-accessories/braloba-leather-for-watch-active-gray-gp-xvr500brcjw/?cid=es_pd_ppc_google_correa-braloba-active-leather-20mm-galaxy-watch-active-andamp;-galaxy-watch3-gp-xvr500brcjw_ongoing_im-accessories-automatic-feed_pla_none_none,https://images.samsung.com/is/image/samsung/p6pim/es/gp-xvr500brcjw/gallery/es-braloba-leather-for-watch-active-gp-xvr500brcjw-341042752?$320_320_PNG$,Samsung,new,in stock,29.00 EUR,29.00 EUR,Accesorios wearables
RB38A7B5D39/EF,8806092253032,Frigorífico Bespoke Satin Beige 2m - RB38A7B5D39,,https://www.samsung.com/es/refrigerators/bespoke-refrigerators/rb7300-390l-clay-beige-rb38a7b5d39-ef/?cid=es_pd_ppc_google_frigorifico-bespoke-satin-beige-2m---rb38a7b5d39-rb38a7b5d39-ef_ongoing_da-refrigerator-automatic-feed_pla_none_none,https://images.samsung.com/is/image/samsung/p6pim/es/rb38a7b5d39-ef/gallery/es-bespoke-rb7300-385149-rb38a7b5d39-ef-426999346?$320_320_PNG$,Samsung,new,in stock,1029.00 EUR,693.03 EUR,Productos | Electrodomesticos | Frigorificos | Bespoke | Electrodomesticos | Frigorificos | Bespoke
RR39A746341/ES,8806092562905,Frigorífico Bespoke Twin Glam Navy 387L - RR39A746341,,https://www.samsung.com/es/refrigerators/bespoke-refrigerators/rr7000m-387l-navy-rr39a746341-es/?cid=es_pd_ppc_google_frigorifico-bespoke-twin-glam-navy-387l---rr39a746341-rr39a746341-es_ongoing_da-refrigerator-automatic-feed_pla_none_none,https://images.samsung.com/is/image/samsung/p6pim/es/rr39a746341-es/gallery/es-fridge-bespoke-rr7000-386341-rr39a746341-es-431693400?$320_320_PNG$,Samsung,new,in stock,1079.01 EUR,1079.01 EUR,Productos | Electrodomesticos | Frigorificos | Bespoke | Electrodomesticos | Frigorificos | Bespoke
RZ32A748541/ES,8806092562929,Congelador Bespoke Twin Glam Navy 323L - RZ32A748541,,https://www.samsung.com/es/refrigerators/bespoke-refrigerators/rr7000m-323l-navy-rz32a748541-es/?cid=es_pd_ppc_google_congelador-bespoke-twin-glam-navy-323l---rz32a748541-rz32a748541-es_ongoing_da-refrigerator-automatic-feed_pla_none_none,https://images.samsung.com/is/image/samsung/p6pim/es/rz32a748541-es/gallery/es-freezer-bespoke-rr7000m-386362-rz32a748541-es-431694567?$320_320_PNG$,Samsung,new,in stock,1079.01 EUR,726.71 EUR,Productos | Electrodomesticos | Frigorificos | Bespoke | Electrodomesticos | Frigorificos | Bespoke
RB34A7B5D39/EF,8806092253834,"Frigorífico Bespoke Beige 1,85m - RB34A7B5D39","No malgastes tu tiempo y energía descongelando el frigorífico. La tecnología No Frost optimiza la circulación del aire para mantener una temperatura constante que previene la formación de hielo. También alcanza la temperatura adecuada mucho más rápido y hace trabajar menos al sistema de enfriamiento, por lo que durará más tiempo.","https://www.samsung.com/es/refrigerators/bespoke-refrigerators/rb7300-344l-clay-beige-rb34a7b5d39-ef/?cid=es_pd_ppc_google_frigorifico-bespoke-beige-1,85m---rb34a7b5d39-rb34a7b5d39-ef_ongoing_da-refrigerator-automatic-feed_pla_none_none",https://images.samsung.com/is/image/samsung/p6pim/es/rb34a7b5d39-ef/gallery/es-bespoke-rb7300-rb34a7b5d39-ef-423097952?$320_320_PNG$,Samsung,new,in stock,979.00 EUR,659.36 EUR,Productos | Electrodomesticos | Frigorificos | Bespoke | Electrodomesticos | Frigorificos | Bespoke
RR39A746339/ES,8806092562899,Frigorífico Bespoke Twin Satin Beige 387L - RR39A746339,,https://www.samsung.com/es/refrigerators/bespoke-refrigerators/rr7000m-387l-clay-beige-rr39a746339-es/?cid=es_pd_ppc_google_frigorifico-bespoke-twin-satin-beige-387l---rr39a746339-rr39a746339-es_ongoing_da-refrigerator-automatic-feed_pla_none_none,https://images.samsung.com/is/image/samsung/p6pim/es/rr39a746339-es/gallery/es-fridge-bespoke-rr7000-rr39a746339-es-431169552?$320_320_PNG$,Samsung,new,in stock,1079.01 EUR,879.36 EUR,Productos | Electrodomesticos | Frigorificos | Bespoke | Electrodomesticos | Frigorificos | Bespoke
RZ32A748539/ES,8806092562912,Congelador Bespoke Twin Satin Beige 323L - RZ32A748539,,https://www.samsung.com/es/refrigerators/bespoke-refrigerators/rr7000m-323l-clay-beige-rz32a748539-es/?cid=es_pd_ppc_google_congelador-bespoke-twin-satin-beige-323l---rz32a748539-rz32a748539-es_ongoing_da-refrigerator-automatic-feed_pla_none_none,https://images.samsung.com/is/image/samsung/p6pim/es/rz32a748539-es/gallery/es-freezer-bespoke-rr7000m-rz32a748539-es-431634431?$320_320_PNG$,Samsung,new,preorder,1079.01 EUR,879.36 EUR,Productos | Electrodomesticos | Frigorificos | Bespoke | Electrodomesticos | Frigorificos | Bespoke
RB34A7B5D41/EF,8806092313576,"Frigorífico Bespoke Glam Navy 1,85m - RB34A7B5D41",,"https://www.samsung.com/es/refrigerators/bespoke-refrigerators/rb7300-344l-navy-rb34a7b5d41-ef/?cid=es_pd_ppc_google_frigorifico-bespoke-glam-navy-1,85m---rb34a7b5d41-rb34a7b5d41-ef_ongoing_da-refrigerator-automatic-feed_pla_none_none",https://images.samsung.com/is/image/samsung/p6pim/es/rb34a7b5d41-ef/gallery/es-bespoke-rb7300-385569-rb34a7b5d41-ef-428267575?$320_320_PNG$,Samsung,new,in stock,979.00 EUR,659.36 EUR,Productos | Electrodomesticos | Frigorificos | Bespoke | Electrodomesticos | Frigorificos | Bespoke
